{
  "name": "Veripsa",
  "title": "Veripsa — Paused (acknowledge to proceed)",
  "token": "Paused (acknowledge to proceed)",
  "conclusion": "action_required",
  "underlyingVerdict": "wait_in_line",
  "prNumber": 43,
  "repositoryFullName": "example/repo",
  "headSha": "89abcdef0123456789abcdef0123456789abcdef",
  "acknowledged": false
}
